{
  "schema_version": "groundsignal.search-run.v1",
  "id": "run_550c0d4358ac14397631",
  "created_at": "2026-10-18T17:00:15.073197+00:00",
  "finished_at": "2026-10-18T17:00:15.080094+00:00",
  "synthetic": true,
  "status": "SYNTHETIC_ONLY",
  "target": {
    "id": "synthetic_chip",
    "name": "星港芯片（虚构）",
    "aliases": [
      "星港芯片"
    ],
    "official_domains": [
      "chip.example.invalid"
    ],
    "identity_status": "UNCONFIRMED",
    "dimensions": [
      "upstream",
      "downstream",
      "competitors",
      "investors",
      "investments",
      "people",
      "products",
      "capacity",
      "counterevidence"
    ],
    "time_range": {
      "after": null,
      "before": null
    },
    "seed_urls": []
  },
  "config": {
    "providers": [
      "brave",
      "tavily",
      "deepseek"
    ],
    "fetcher": "http",
    "pdf_parser": "pypdf",
    "routing_mode": "cascade",
    "audit_fraction": 0.2,
    "budget": {
      "max_queries": 18,
      "max_search_calls": 24,
      "results_per_query": 4,
      "max_documents": 8,
      "max_model_calls": 12,
      "max_large_calls": 4,
      "max_input_chars": 12000,
      "max_output_tokens": 2048,
      "max_bytes": 8000000,
      "timeout_seconds": 20,
      "max_elapsed_seconds": 240,
      "request_interval_seconds": 1,
      "cache_ttl_seconds": 21600,
      "max_fetch_calls": 32
    },
    "models": {
      "small": {
        "enabled": false,
        "base_url": "http://127.0.0.1:11434/v1",
        "model": "qwen3.5:9b",
        "api_key_env": null,
        "extra_body": {}
      },
      "large": {
        "enabled": false,
        "base_url": "https://api.deepseek.com",
        "model": "deepseek-flash",
        "api_key_env": "DEEPSEEK_API_KEY",
        "extra_body": {
          "thinking": {
            "type": "disabled"
          }
        }
      }
    }
  },
  "plan": {
    "schema_version": "groundsignal.search-plan.v1",
    "created_at": "2026-10-18T17:00:15.073521+00:00",
    "target": {
      "id": "synthetic_chip",
      "name": "星港芯片（虚构）",
      "aliases": [
        "星港芯片"
      ],
      "official_domains": [
        "chip.example.invalid"
      ],
      "identity_status": "UNCONFIRMED",
      "dimensions": [
        "upstream",
        "downstream",
        "competitors",
        "investors",
        "investments",
        "people",
        "products",
        "capacity",
        "counterevidence"
      ],
      "time_range": {
        "after": null,
        "before": null
      },
      "seed_urls": []
    },
    "budget": {
      "max_queries": 18,
      "max_search_calls": 24,
      "results_per_query": 4,
      "max_documents": 8,
      "max_model_calls": 12,
      "max_large_calls": 4,
      "max_input_chars": 12000,
      "max_output_tokens": 2048,
      "max_bytes": 8000000,
      "timeout_seconds": 20,
      "max_elapsed_seconds": 240,
      "request_interval_seconds": 1,
      "cache_ttl_seconds": 21600,
      "max_fetch_calls": 32
    },
    "queries": [
      {
        "id": "q_6b3530c52a1c47cb",
        "dimension": "upstream",
        "query": "\"星港芯片（虚构）\" 供应商 代工 封装 材料",
        "purpose": "discovery_zh",
        "time_filter": "query_hint_not_verified"
      },
      {
        "id": "q_190530ce6744b9b6",
        "dimension": "downstream",
        "query": "\"星港芯片（虚构）\" 客户 采购 中标 订单",
        "purpose": "discovery_zh",
        "time_filter": "query_hint_not_verified"
      },
      {
        "id": "q_125d7b4c53a2e2cf",
        "dimension": "competitors",
        "query": "\"星港芯片（虚构）\" 竞争对手 产品 替代",
        "purpose": "discovery_zh",
        "time_filter": "query_hint_not_verified"
      },
      {
        "id": "q_5d7ad0255b12b597",
        "dimension": "investors",
        "query": "\"星港芯片（虚构）\" 股东 融资 投资方",
        "purpose": "discovery_zh",
        "time_filter": "query_hint_not_verified"
      },
      {
        "id": "q_bc8282f5dbac62e9",
        "dimension": "investments",
        "query": "\"星港芯片（虚构）\" 对外投资 控股 全资子公司",
        "purpose": "discovery_zh",
        "time_filter": "query_hint_not_verified"
      },
      {
        "id": "q_66a3b79f19e34a79",
        "dimension": "people",
        "query": "\"星港芯片（虚构）\" 创始人 实际控制人 管理层",
        "purpose": "discovery_zh",
        "time_filter": "query_hint_not_verified"
      },
      {
        "id": "q_20f9aaee8d477c14",
        "dimension": "products",
        "query": "\"星港芯片（虚构）\" 产品 认证 量产 技术",
        "purpose": "discovery_zh",
        "time_filter": "query_hint_not_verified"
      },
      {
        "id": "q_1727bb3d5c484085",
        "dimension": "capacity",
        "query": "\"星港芯片（虚构）\" 工厂 产能 扩产 投产",
        "purpose": "discovery_zh",
        "time_filter": "query_hint_not_verified"
      },
      {
        "id": "q_00f7c041b65d0842",
        "dimension": "counterevidence",
        "query": "\"星港芯片（虚构）\" 否认 终止 更正 延期",
        "purpose": "discovery_zh",
        "time_filter": "query_hint_not_verified"
      },
      {
        "id": "q_84fd1c4d2ca9820f",
        "dimension": "upstream",
        "query": "\"星港芯片\" suppliers foundry packaging",
        "purpose": "discovery_en",
        "time_filter": "query_hint_not_verified"
      },
      {
        "id": "q_77153571c2fcfb39",
        "dimension": "downstream",
        "query": "\"星港芯片\" customers procurement shipment",
        "purpose": "discovery_en",
        "time_filter": "query_hint_not_verified"
      },
      {
        "id": "q_a989a1744f859487",
        "dimension": "competitors",
        "query": "\"星港芯片\" competitors product alternatives",
        "purpose": "discovery_en",
        "time_filter": "query_hint_not_verified"
      },
      {
        "id": "q_2249109420231e9e",
        "dimension": "investors",
        "query": "\"星港芯片\" shareholders funding investors",
        "purpose": "discovery_en",
        "time_filter": "query_hint_not_verified"
      },
      {
        "id": "q_6f75ab4fd717617d",
        "dimension": "investments",
        "query": "\"星港芯片\" investments subsidiaries ownership",
        "purpose": "discovery_en",
        "time_filter": "query_hint_not_verified"
      },
      {
        "id": "q_a0072e55569d2e0c",
        "dimension": "people",
        "query": "\"星港芯片\" founder beneficial owner management",
        "purpose": "discovery_en",
        "time_filter": "query_hint_not_verified"
      },
      {
        "id": "q_2f328b2fd2d2a011",
        "dimension": "products",
        "query": "\"星港芯片\" products qualification production",
        "purpose": "discovery_en",
        "time_filter": "query_hint_not_verified"
      },
      {
        "id": "q_fe4a0b3395acc53f",
        "dimension": "capacity",
        "query": "\"星港芯片\" factory capacity expansion",
        "purpose": "discovery_en",
        "time_filter": "query_hint_not_verified"
      },
      {
        "id": "q_d73674dea1ac5e4c",
        "dimension": "counterevidence",
        "query": "\"星港芯片\" denied terminated correction delayed",
        "purpose": "discovery_en",
        "time_filter": "query_hint_not_verified"
      }
    ],
    "unplanned_dimensions": []
  },
  "search_records": [
    {
      "provider": "fixture",
      "query_id": "q_6b3530c52a1c47cb",
      "query": "\"星港芯片（虚构）\" 供应商 代工 封装 材料",
      "dimension": "upstream",
      "searched_at": "2026-10-18T17:00:15.073197+00:00",
      "status": "SIMULATED",
      "cached": false,
      "hits": [
        {
          "url": "https://source.example.invalid/reprint",
          "title": "星港芯片（虚构） reprint",
          "snippet": "星港芯片（虚构）已向云帆计算（虚构）交付海潮一号（虚构）试产样品，仍处于客户测试阶段，尚未量产。",
          "rank": 1,
          "published_hint": null
        }
      ],
      "usage": {},
      "error_code": null
    },
    {
      "provider": "fixture",
      "query_id": "q_190530ce6744b9b6",
      "query": "\"星港芯片（虚构）\" 客户 采购 中标 订单",
      "dimension": "downstream",
      "searched_at": "2026-10-18T17:00:15.073197+00:00",
      "status": "SIMULATED",
      "cached": false,
      "hits": [
        {
          "url": "https://source.example.invalid/sample",
          "title": "星港芯片（虚构） sample",
          "snippet": "星港芯片（虚构）已向云帆计算（虚构）交付海潮一号（虚构）试产样品，仍处于客户测试阶段，尚未量产。",
          "rank": 1,
          "published_hint": null
        }
      ],
      "usage": {},
      "error_code": null
    },
    {
      "provider": "fixture",
      "query_id": "q_125d7b4c53a2e2cf",
      "query": "\"星港芯片（虚构）\" 竞争对手 产品 替代",
      "dimension": "competitors",
      "searched_at": "2026-10-18T17:00:15.073197+00:00",
      "status": "SIMULATED",
      "cached": false,
      "hits": [],
      "usage": {},
      "error_code": null
    },
    {
      "provider": "fixture",
      "query_id": "q_5d7ad0255b12b597",
      "query": "\"星港芯片（虚构）\" 股东 融资 投资方",
      "dimension": "investors",
      "searched_at": "2026-10-18T17:00:15.073197+00:00",
      "status": "SIMULATED",
      "cached": false,
      "hits": [
        {
          "url": "https://source.example.invalid/ownership",
          "title": "星港芯片（虚构） ownership",
          "snippet": "晨星基金（虚构）持有星港芯片（虚构）8%的股权，星港芯片（虚构）仍由其创始团队控制。",
          "rank": 1,
          "published_hint": null
        }
      ],
      "usage": {},
      "error_code": null
    },
    {
      "provider": "fixture",
      "query_id": "q_bc8282f5dbac62e9",
      "query": "\"星港芯片（虚构）\" 对外投资 控股 全资子公司",
      "dimension": "investments",
      "searched_at": "2026-10-18T17:00:15.073197+00:00",
      "status": "SIMULATED",
      "cached": false,
      "hits": [],
      "usage": {},
      "error_code": null
    },
    {
      "provider": "fixture",
      "query_id": "q_66a3b79f19e34a79",
      "query": "\"星港芯片（虚构）\" 创始人 实际控制人 管理层",
      "dimension": "people",
      "searched_at": "2026-10-18T17:00:15.073197+00:00",
      "status": "SIMULATED",
      "cached": false,
      "hits": [],
      "usage": {},
      "error_code": null
    },
    {
      "provider": "fixture",
      "query_id": "q_20f9aaee8d477c14",
      "query": "\"星港芯片（虚构）\" 产品 认证 量产 技术",
      "dimension": "products",